{
    "unitId": "maag-eq4",
    "name": "Maag EQ4 500 Series Equalizer",
    "manufacturer": "Maag Audio",
    "tags": [
        "Maag",
        "500 series",
        "equalizer",
        "5-band",
        "Air band",
        "Reinhold Maag"
    ],
    "version": "1.0.0",
    "category": "equalizer",
    "formFactor": "500-series",
    "faceplateImage": "assets/faceplates/maag-eq4-1.0.0.png",
    "thumbnailImage": "assets/thumbnails/maag-eq4-1.0.0.png",
    "width": 150,
    "height": 525,
    "controls": [
        {
            "id": "air-freq",
            "label": "Air Freq",
            "type": "knob",
            "position": {
                "x": 0.33,
                "y": 0.092
            },
            "value": 78,
            "startAngle": 78,
            "endAngle": 250,
            "steps": [
                78,
                107,
                145,
                180,
                215,
                250
            ],
            "currentStepIndex": 0,
            "image": "assets/controls/knobs/rogan-sm-blue.png"
        },
        {
            "id": "air-gain",
            "label": "Air Gain",
            "type": "knob",
            "position": {
                "x": 0.27,
                "y": 0.26
            },
            "value": 20,
            "startAngle": 20,
            "endAngle": 350,
            "image": "assets/controls/knobs/rogan-sm-yellow.png"
        },
        {
            "id": "2k5-gain",
            "label": "2.5k Gain",
            "type": "knob",
            "position": {
                "x": 0.54,
                "y": 0.38
            },
            "value": 180,
            "startAngle": 20,
            "endAngle": 350,
            "image": "assets/controls/knobs/rogan-sm-orange.png"
        },
        {
            "id": "650-gain",
            "label": "650 Gain",
            "type": "knob",
            "position": {
                "x": 0.27,
                "y": 0.49
            },
            "value": 180,
            "startAngle": 20,
            "endAngle": 350,
            "image": "assets/controls/knobs/rogan-sm-red.png"
        },
        {
            "id": "160-gain",
            "label": "160 Gain",
            "type": "knob",
            "position": {
                "x": 0.54,
                "y": 0.61
            },
            "value": 180,
            "startAngle": 20,
            "endAngle": 350,
            "image": "assets/controls/knobs/rogan-sm-green.png"
        },
        {
            "id": "40-gain",
            "label": "40 Gain",
            "type": "knob",
            "position": {
                "x": 0.27,
                "y": 0.725
            },
            "value": 180,
            "startAngle": 20,
            "endAngle": 350,
            "image": "assets/controls/knobs/rogan-sm-blue.png"
        },
        {
            "id": "sub-gain",
            "label": "Sub Gain",
            "type": "knob",
            "position": {
                "x": 0.54,
                "y": 0.842
            },
            "value": 180,
            "startAngle": 20,
            "endAngle": 350,
            "image": "assets/controls/knobs/rogan-sm-black.png"
        },
        {
            "id": "bypass",
            "label": "Bypass",
            "type": "button",
            "position": {
                "x": 0.125,
                "y": 0.865
            },
            "momentary": false,
            "value": 0,
            "options": [
                {
                    "value": "Out",
                    "frame": {
                        "x": 0,
                        "y": 0,
                        "width": 55,
                        "height": 37
                    },
                    "label": "Out"
                },
                {
                    "value": "In",
                    "frame": {
                        "x": 0,
                        "y": 37,
                        "width": 55,
                        "height": 37
                    },
                    "label": "In"
                }
            ],
            "image": "assets/controls/buttons/button-maag-led-left-sm-black.png"
        }
    ]
}